{
  "$id": "content/rules.schema.json",
  "$schema": "https://json-schema.org/draft/2020-12/schema",
  "additionalProperties": false,
  "properties": {
    "$schema": {
      "type": "string"
    },
    "base_industry_output_per_turn": {
      "minimum": 0,
      "type": "integer"
    },
    "base_research_output_per_turn": {
      "minimum": 0,
      "type": "integer"
    },
    "bonus_tokens_per_turn": {
      "minimum": 0,
      "type": "integer"
    },
    "city_core_max_hp": {
      "minimum": 0,
      "type": "integer"
    },
    "facility_takeover_turns": {
      "minimum": 0,
      "type": "integer"
    },
    "initial_city_territory_radius": {
      "minimum": 0,
      "type": "integer"
    },
    "max_turns": {
      "minimum": 1,
      "type": "integer"
    },
    "minimum_city_distance": {
      "minimum": 0,
      "type": "integer"
    },
    "road_base_capacity": {
      "minimum": 0,
      "type": "integer"
    },
    "safe_zone_radius": {
      "minimum": 0,
      "type": "integer"
    },
    "storage_raid_amount": {
      "minimum": 0,
      "type": "integer"
    },
    "tokens_per_turn": {
      "minimum": 0,
      "type": "integer"
    },
    "turn_time_limit_planning": {
      "minimum": 1,
      "type": "integer"
    }
  },
  "required": [
    "turn_time_limit_planning",
    "tokens_per_turn",
    "bonus_tokens_per_turn",
    "max_turns",
    "city_core_max_hp",
    "safe_zone_radius",
    "facility_takeover_turns",
    "base_research_output_per_turn",
    "base_industry_output_per_turn",
    "minimum_city_distance",
    "initial_city_territory_radius"
  ],
  "type": "object"
}
